{"schema_version":1,"provider_id":"teacher_recruit_newtaipei","source_files":{"exams":{"2026.json":2291},"papers":{"2026.json":4740}},"bundle_ids":["teacher-recruit-newtaipei-teacher-recruitment-not-applicable-teacher-recruit-newtaipei"],"canonical_ids":["teacher-recruit-newtaipei"],"raw_events":[["teacher-recruit-newtaipei-115-preschool",2026,true],["teacher-recruit-newtaipei-115-junior",2026,true]],"papers":[["teacher-recruit-newtaipei-115-preschool","115","preschool","answer",115,0,0,"68180dfda1f0bd31f9896030ec3afdc52215bbd7e37d90fbb6bbaba5fc02164a","providers/teacher_recruit_newtaipei/115/teacher-recruit-newtaipei-115-preschool/115/preschool/answer.pdf","115-preschool-answer",false],["teacher-recruit-newtaipei-115-preschool","115","preschool","question",115,0,0,"ee5fdf35aefdc4b3a1cb28e8aa3f6ce877380a25bda4ba7aef0aa87f0ef36460","providers/teacher_recruit_newtaipei/115/teacher-recruit-newtaipei-115-preschool/115/preschool/question.pdf","115-preschool-question",false],["teacher-recruit-newtaipei-115-junior","115","junior","question_answer",115,0,0,"92b51ab85396fe4addc31218ccd46709519daa713fd9443b5899f41bdbe6da58","providers/teacher_recruit_newtaipei/115/teacher-recruit-newtaipei-115-junior/115/junior/question_answer.rar","115-junior-question_answer",false]]}