{"schema_version":1,"provider_id":"teacher_recruit_taipei_elementary","source_files":{"exams":{"2025.json":9782},"papers":{"2025.json":20812}},"bundle_ids":["teacher-recruit-taipei-elementary-teacher-recruitment-not-applicable-teacher-recruit-taipei-elementary"],"canonical_ids":["teacher-recruit-taipei-elementary"],"raw_events":[["teacher-recruit-taipei-elementary-114",2025,true]],"papers":[["teacher-recruit-taipei-elementary-114","114","basic-category-knowledge","question_answer",114,0,0,"212dfd64b42762e3fcdca7f6dcf600fb59b049cac23ab1c4113235db0834c0ba","providers/teacher_recruit_taipei_elementary/114/teacher-recruit-taipei-elementary-114/114/basic-category-knowledge/question_answer.pdf","114-basic-category-knowledge-question_answer",false],["teacher-recruit-taipei-elementary-114","114","counseling","question_answer",114,0,0,"89525bbff41f9cd2f98050853c90ad95c6513e5884ceac2783dfbf9a24561d74","providers/teacher_recruit_taipei_elementary/114/teacher-recruit-taipei-elementary-114/114/counseling/question_answer.pdf","114-counseling-question_answer",false],["teacher-recruit-taipei-elementary-114","114","english","question_answer",114,0,0,"a5f4f60aa7d37aa852af78c6f6be401fe264b40681976dc8579fd1927362d460","providers/teacher_recruit_taipei_elementary/114/teacher-recruit-taipei-elementary-114/114/english/question_answer.pdf","114-english-question_answer",false],["teacher-recruit-taipei-elementary-114","114","general","question_answer",114,0,0,"4f380e262a36d6e6b7dc8575d8f2506a51ef85c6ac69e51e41efd052de58037b","providers/teacher_recruit_taipei_elementary/114/teacher-recruit-taipei-elementary-114/114/general/question_answer.pdf","114-general-question_answer",false],["teacher-recruit-taipei-elementary-114","114","information-technology","question_answer",114,0,0,"328c0e82be12540f69426a264fcf6c3ab19570a362f5edc16d0b96859c956f27","providers/teacher_recruit_taipei_elementary/114/teacher-recruit-taipei-elementary-114/114/information-technology/question_answer.pdf","114-information-technology-question_answer",false],["teacher-recruit-taipei-elementary-114","114","music","question_answer",114,0,0,"a3f101dccf651f0a6ee41bf3994e6eccd491fbaa3db8ee82f69bd9de98e6af01","providers/teacher_recruit_taipei_elementary/114/teacher-recruit-taipei-elementary-114/114/music/question_answer.pdf","114-music-question_answer",false],["teacher-recruit-taipei-elementary-114","114","physical-education","question_answer",114,0,0,"d4aedd353757992b540a53be08b02c548166011410e754b14a0c235394d50fb7","providers/teacher_recruit_taipei_elementary/114/teacher-recruit-taipei-elementary-114/114/physical-education/question_answer.pdf","114-physical-education-question_answer",false],["teacher-recruit-taipei-elementary-114","114","science","question_answer",114,0,0,"4fef4c9d2e80f940ba76857bbedf85be33d4a60149f585921dae80bf59b2565a","providers/teacher_recruit_taipei_elementary/114/teacher-recruit-taipei-elementary-114/114/science/question_answer.pdf","114-science-question_answer",false],["teacher-recruit-taipei-elementary-114","114","special-education-disability","question_answer",114,0,0,"a5f0af637aef510b4a5e3d1b218c364ad3b6b4496d980f44fbb3d5e2344497f5","providers/teacher_recruit_taipei_elementary/114/teacher-recruit-taipei-elementary-114/114/special-education-disability/question_answer.pdf","114-special-education-disability-question_answer",false],["teacher-recruit-taipei-elementary-114","114","special-education-gifted","question_answer",114,0,0,"5d49f5312fbe69b690e58eba82410eb0d8627e6d551a7fe9c0c1b4d2975b54d1","providers/teacher_recruit_taipei_elementary/114/teacher-recruit-taipei-elementary-114/114/special-education-gifted/question_answer.pdf","114-special-education-gifted-question_answer",false],["teacher-recruit-taipei-elementary-114","114","taiwanese-minnan","question_answer",114,0,0,"0d4b9a8989228c529f870b4e8485dcec0f23dab8e8b95aae8cf380cd7d007f8c","providers/teacher_recruit_taipei_elementary/114/teacher-recruit-taipei-elementary-114/114/taiwanese-minnan/question_answer.pdf","114-taiwanese-minnan-question_answer",false],["teacher-recruit-taipei-elementary-114","114","visual-arts","question_answer",114,0,0,"18b6e460c180b61c6fef9b5993ddb8cdb35db55ccb42ef97927fb4bc696b697d","providers/teacher_recruit_taipei_elementary/114/teacher-recruit-taipei-elementary-114/114/visual-arts/question_answer.pdf","114-visual-arts-question_answer",false]]}