{"schema_version":1,"provider_id":"teacher_recruit_kaohsiung","source_files":{"exams":{"2026.json":1773},"papers":{"2026.json":3150}},"bundle_ids":["teacher-recruit-kaohsiung-teacher-recruitment-not-applicable-teacher-recruit-kaohsiung"],"canonical_ids":["teacher-recruit-kaohsiung"],"raw_events":[["teacher-recruit-kaohsiung-115-elementary",2026,false],["teacher-recruit-kaohsiung-115-special",2026,true]],"papers":[["teacher-recruit-kaohsiung-115-special","special","subject-e6b0a069","corrected_answer",115,0,0,"68dc00baa2c19594e211beb26ffdbdb062565638447a0a3cc683995e380eaa80","providers/teacher_recruit_kaohsiung/115/teacher-recruit-kaohsiung-115-special/special/subject-e6b0a069/corrected_answer.pdf","special-subject-e6b0a069-corrected_answer",false],["teacher-recruit-kaohsiung-115-special","special","subject-088f06f6","corrected_answer",115,0,0,"de04c408b59a1023fe7253c33e3656c2d9c82f2cc1ec5826bcf475a214bc3a0c","providers/teacher_recruit_kaohsiung/115/teacher-recruit-kaohsiung-115-special/special/subject-088f06f6/corrected_answer.pdf","special-subject-088f06f6-corrected_answer",false]]}